,index,text,class_id,website,author
1781881,2134379,"Michael took a step towards the commotion.  He appears to be more of a ""fight"" than a ""flight"" guy.  Good on him.",1,The Daily Wire,Taylor West
1780138,2164552,"Nailed it!! I had the same thoughts, only auxiliary characters died and the battle plan was absurd.

As far as Arya not being a Mary Sue though he is wrong, as she get somehow gets past a horde of wights and white walker generals.",1,The Daily Wire,LiberatedMind
1019154,1893280,How you buy a house if you are illegal only I you are residents he is hiding something he broke the law people sometimes buy homes with stole identity happen to my friend.  He broke the law in some way . But they don't say in this tv series .????,0,The Atlantic,Renaldo Lopez
337460,1784483,"I liké Beyoncé but Michael Jackson was known All over the world and I mean EVERYWHERE..the men from Mozambique who taught her the choreography for ""We run the world"" didn't even know who she was.",0,The Root,Maryse Matoko
1797894,1920586,I would love to sit in that back yard with all those sweet cats this is awesome I wish I could have something like that🐱🐺,0,The Atlantic,Tracy S.
2053194,1982271,"Try running at 0.75x. It becomes perfectly normal. So the conclusion is, he speaks at 1.33x (i.e. 1/0.75 x for those weak in Maths)",1,The Daily Wire,Aditya Ganjoo
1566070,127960,"There is a huge blue wave coming, as in: wave good bye. To the Dems.",1,One America News Network,J.carlos 1
1561805,1788259,"This. The government writes you a check, the lowest amount to make you think they are actually fighting for you. However, it is never enough to actually move you forward, leaving you stuck and dependent on them. The government profits from minorities staying marginalized, both the extreme right and the extreme left. The right is a wolf and the left is just a wolf in sheeps clothing. Fixing the wage gap would actually require hard work and rebuilding a broken system, fixing our schools, ending our war on drugs, giving minorities the  access to the opportunities and tools they need for success, all things that would take far more money out of the government's pocket, than simply throwing a small check with the memo ""sorry for the slavery"" would. I'm speaking as a white middle class female obviously, and I have no first-hand understanding of what it means to grow up today as a person of color, however, I do know that I am disgusted by the constant pandering politicians are directing towards minorities and the american people as a whole, with no real progress towards living breathing equality. I think minorities are sick of being used as social pawns in a system that ultimately uses them for a vote, and then profits off of their empty promises. Sorry long puke rant. Done. Yang has my vote. Not right or left. Just forward.",0,The Root,Brie Z
949570,1798892,Tha Pume lmao thank you since we're being technical,0,The Root,Lawless
1675836,2211250,"Because homosexuals couldn't have possibly been produced from heterosexual unions between man and woman. It is ridiculous to think that homosexuals had both mothers and fathers. I would love to see a biology book written by Pat Robertson. I would be the first to make sure it was instilled as required learning for all children, along with mandated belief in Santa Clause and The Easter Bunny.",0,RWW Blog,errol mcinnes
364854,2079796,E.L.Dorado there’s a difference between leftists and liberals,1,The Daily Wire,samuel rappaport
1192788,1126790,I will not unify with a usurper who stole an election and its implementing big tech and government combined fascism.,1,MRCTV,DAN M
758944,105206,I don't understand why anybody else isnt reporting this. Certainly Fox News would pick up this. Something's wrong.,1,One America News Network,Billy R
1545665,1243655,Why are they not posting the testimony of the poll watcher?!,1,Newsmax TV,Grace Lytax
529739,399841,"New amendment: ""You have the right to eat the cake you want to eat""",1,Campus Reform,Crispin Fornoff
1118554,44857,@Epic Gamer What's lame is running a mentally deficient 78 year old Democrat for President.,1,One America News Network,big vito
705688,627965,Buongiorno caro presidente Trump 👌💕💕🥰 dio Milo benedica famiglia tutto ill Tim sopportiamo la america dio benedica tutti americani 🙏🙏🙏,1,Right Side Broadcasting Network,tania garcia duenas
616520,913635,This is what happens in a godless society.,1,Breitbart News,Laddie McGee
192534,1368248,"The far left are the leaders, Antifa is the infiltrators as well as the commanders, and BLM are the foot soldiers. They've just built an army in front of our very own eyes.",1,Fox News,GameWarrior2216
528929,1661424,"You know what the biggest problem with our instutions that set laws for the masses is? From my perspective  it is their total disregard of these, what appears is complete immunity of laws placed on sociey. I use And to  emphatically emphasize the fact that this so called governing body has no accountability for breaking of such laws passed...Darn em all...",1,BlazeTV,Tony Adcock
2199774,1579265,I also want to add the other shivery Gymboree liver lip Steven asinine Smith 2 a sadly probable better sense of reasoning than Anthony fauci....ha ha ha lol .,1,BlazeTV,Andrew Romano
1726406,1126965,"Yes, the left are evil. Thank you for the reality check.",1,MRCTV,critical-thought
1141942,871237,Countries with more balls than America wtf the land of the free is slowly being destroyed,1,Breitbart News,ASG Rides
1209607,1628784,"@Eric Callender do explain what exactly the lies are that you commented on?
Ol’ Slow Joe is the man who has always been known as a liar. First in his class etc, it goes way back because he has always lied. Just like he did about forgiving the student loan debts, he never even made it into office before that was taken off the table. Now he has begun to “Build back better”? By stopping the XL pipeline, gotta protect all off his friends in the oil business. Stopped construction on the border wall. Thousands upon thousands of jobs destroyed on his first day in office. What a joke this man is, he will sign anything his advisors put in front of him. 
So I’m waiting.....lets hear what the lies are that you claim President Trump is stating.",1,BlazeTV,Everett Bennett
293838,68840,This already has a fact checker warning attached before I could share it. Smh,1,One America News Network,A. K.
2106830,861915,i want to trust him but i do not  . lets  see  some results  talk is cheap,1,Breitbart News,THE OGIE MOFO
1635041,1163449,UK don't want him back after breaking The Bank of England.,1,Newsmax TV,SB
179075,1081458,This is priceless. Those who don't find this funny are typical leftists who can't take a joke.,1,MRCTV,Paul V
290731,1895511,"I despise when parents share their kids photos on the internet, and not just because I don't care if your kid said their first word or went to their first soccer training. I've had to delete photos of kids in nothing but a diaper from a facebook group I manage (that has nothing to do with children or parenthood) because the mom posting didn't see anything wrong with posting a half naked photo of her child to a group of over 100k strangers on the internet. There are predators everywhere - they can even be in your friends list and your kid doesn't need to be naked to end up on the darkest spots on the internet. Your child has a right to their privacy and safety! If you have to share photos of your child, make sure your privacy settings are on lockdown.",0,The Atlantic,ChaoticShelly
1591078,810571,"Criminal video deleting! Just like Hillary Clinton!😡😠👎 They sure did admit guilt by deleting yesterday's video!!

God bless ya'll!!!🙏👍💪",1,Project Veritas,John Potter
949919,1337642,WHEN THEY ADD MILLIONS OF VOTES ILLEGALLY AND THROW OUT MILLIONS OF TRUMPS VOTES GET REAL THIS CANNOT BE A FAIR ELECTION,1,Newsmax TV,ERIC CRAWFORD
305768,1989947,"@Collins Ongaya The innocent civilians. If they were slaying people they wouldn't be civilians. That's why the body count is 109.000 out of which 66.000 are civilians, because there were non-civilian kills.",1,The Daily Wire,Rojirrim
1333443,2035346,My football team does the lords prayer before every game in the locker room and then when we're out on the field everyone prays and then we do the national anthem,1,The Daily Wire,RIPPER 9
43100,136173,This looks like one of those parody news stations like in Robocop or escape from N.Y.,1,One America News Network,The Riff Writer
951742,620737,Thank you for huge smile Florida peeps. #Trump,1,Right Side Broadcasting Network,phyllis betz
98955,420852,Just by looking at them I can anticipate the response.,1,Campus Reform,aydin mora
815164,750088,This disappointing part of this expose is that it's a lot of who they're trying to get money from not who they're ACTUALLY getting money from.,1,Project Veritas,Analytical Chick
607542,362239,"Agreed. The left dose not want to talk about that. ""Peaceful Protests"" yeah right!!",1,The First,"kevin O,Reilly"
1858901,991892,@AmericanPatriot 1776 yes there is a link to the DHS and CISA prepared news release stating the same. Lers hope it's TRUE as I have little faith in the SCOTUS. I fear Kavanaugh is a rino... not sure about Amy barrett,1,CBN News,Jerry Nevius
947337,646174,Does anyone believe for a second this video only got viewed by 2.5 million people?,1,Project Veritas,Nicholas Wong
1339271,1353855,"Juli Cole Thank you, I love hearing Foreign support!  We the World are in this together, and being United will make us stronger!",1,Fox News,Betsy Ross
31393,151535,Unions period need to be abolished. The necessity for them is no longer needed. Teachers pay should be on merit and how well their classes are doing. Bad teachers need to be fired.,1,One America News Network,the0ghost069
1089307,504969,Why the quick cutoff ending with no outro?,1,Campus Reform,Blind Liberty
789954,1341616,"Why only two, where are the rest of them.",1,Newsmax TV,Larry Kimbrel
371137,315143,Oh that’s just great I just bought a pair of toms shoes fuck,1,The First,Rodney Baker
1622860,616331,GOD BLESS YOU RSBN!!!!!!!! YOU GUYS ROCKED THE HOUSE!!!!!!!!!!!!!!!!!!!!,1,Right Side Broadcasting Network,Michael Parsons
270659,1868523,MrManiac3 I need one mounted on my bed or my head 😆 I could listen to them all day 🥰 https://www.youtube.com/watch?v=111jDX-mtag&feature=share,0,The Atlantic,Sherryyy Berryyy
1933140,1142345,EddieTization sorry to be a spelling Nazi but it's Grammar,0,Daily Kos,Justin Bourne
20076,1609464,No you can't fix stupid but you can numb it with a two-by-four.,1,BlazeTV,Mona J
30004,444588,And many are homeless by choice. Littering and hitting in front of a business is not necessary  homeless or not.,1,Campus Reform,Tony Evers
1405145,390223,Already a wall there...it's keeping most people out. Any more pearls of wisdom from you kiddo?,1,Campus Reform,cipher88101
1130084,1061540,He was supposed to retire in 1983. It's on his to-do list,1,CBN News,Aye Dee
1542963,5957,There was a hand recount in Georgia by the Trump campaign and they found no fraud,1,One America News Network,David Online
2160730,2037951,"As fans we just ask for 3 hours on a Sunday. Play your game, collect your paycheck, then go home and talk about all the unity you wish. Keep it off the field and court.",1,The Daily Wire,Jeremy Harris
68735,1014849,0:11 to 0:45 looks like a movie about a nuke or something like that,1,CBN News,Jimmy Newton
846500,1889930,"be careful with your garbage mouth, inferian. Pol Pot is not a devil sent from China. you way of thinking is twisted. you must be tired of your boring life. dont blame other with your country's inability",0,The Atlantic,Xing Ha Lee
1526995,2053950,It almost sounds like the black history museum is just trying to say white people are great? Lol,1,The Daily Wire,Dan
596842,2235881,This is the conservative idea of reaching out to Latinos. Repent that your ancestors existed.,0,RWW Blog,spinnersmetal
1633524,387153,If the government stopped handing out money for kids to go to college the price of tuition would have to drop for people to afford it. Something to think about.,1,Campus Reform,Micky-J Productions
1208741,1303904,Why is Bob Sellout still on Newsmax after bowing down to the Dominion company threats?,1,Newsmax TV,Joe Obiden Bama
845635,1878533,What the hell does intersex have to do with the LGBTQ community?,0,The Atlantic,D Jack
2010960,494977,"I was actually just talking to a guy about how Nazis are National Socialists, he was so confused.",1,Campus Reform,Blitz Krieg
316752,188806,"Video evidence?
1) Obama's Inauguration crowd was bigger than Trump's
2) Trump did call both sides fine people which one side was.",1,One America News Network,Deep Dish
1879771,1610963,"From my understanding, a small number of actual voters in her district actually VOTED. She is 
in congress by winning a majority of a minority number of voters.   Sounds awkward but this is happening all over our eligible",1,BlazeTV,Chris Pitchford
439830,1437587,@Sour Wes oh yeah and in your twisted world your liberal networks are so fair and unbiased and never interrupt.,1,Fox News,Farzana Bland
435437,1028478,"OOO my GOD,i love this, GLORY BE TO GOD ALMIGHTY, AMEN.",1,CBN News,Madu Christianah
84940,1017830,How bout a few good men with 338 Lapua mags and some good German glass problem solved!! El Diablo Tejano's,1,CBN News,kelly moore
41205,1608852,@Sandman 123 Biden has always been close to the white house but never got to be president why is that?  Why did he drop out in his first run? The only way he'll get to sit behind the Resolute desk  if Trump is out of town and that's it.,1,BlazeTV,Spiderbot2000
2152845,199315,"Japan: U dont stop territorial dispute, ok were leaving.",1,The Epoch Times,ji chang wook
1549586,1412237,She has to be sued for everything she has. Or make her give it to the mob. And criminal charges of a hate crime need to filed along with false imprisonment/kidnapping.,1,Fox News,Mikox Bigs
982617,1957252,"Comedy is very often attacking the status quo, and as such its hard to be funny when your philosophy is to defend it all costs.",0,mediamatters4america,concordat
150769,1044072,Yeah it was right there in front of our faces. So stop saying they don’t have evidence. We watched this happen on tv.,1,CBN News,Rob D
848750,1329945,"@Stephen Craig 
So radical brainless indoctrinated say. Hopeless morons don't realize you are being used",1,Newsmax TV,Rapture Ready
1165106,1707256,"Best video I have ever seen on this subject, Glenn you have inspired me too be better!",1,BlazeTV,Jeff Lundstrom
1834635,2227482,"I may be an atheist, but that is completely true. Respect.",0,RWW Blog,Leeroy Jenkins
313801,1844383,"Because race is bigger than religion, much bigger.",0,The Atlantic,chesshooligan 1
1353428,589141,"Why don’t they get Biden to take it , he’s the one they want to be president, and he’s older , thing is it’ll be saline water",1,Right Side Broadcasting Network,Maureen Newman
710912,977934,I HAVES  BEEN PRAYING FOR A WHILE ABOUT PERSECUTION IN OTHER COUNTRIES!!! GOD WILL INTERVENE,1,CBN News,god563616
951399,868711,Funny how this camera man was able to avoid the coverage of Alex Jones. Right side covered it.,1,Breitbart News,Brian Rickard
200606,1934503,"""Dating is legal prostitution""




I'm sorry what",0,mediamatters4america,Bethany
1842387,201306,Anytime now. Trump out the way ...time to invade Taiwan .,1,The Epoch Times,Clay Wilson
1147272,1862117,I gotta sell my properties and move to Madrid.,0,The Atlantic,Nelson Guzman
327022,1773097,And um...ah.......and ...um.....and....ah...,1,BlazeTV,charlie pastrami
287146,1476469,"@ItalianOrlando was thinking about that. Not in CNN's name, but donating to Trump. That would be epic.",1,Fox News,Coulter Sheppard
2217644,1042124,"Ask Siri who is president now and it will tell you Harris , get loud for your freedom before it’s too late",1,CBN News,Mara Shino
188951,1204644,Former Stripper pelosi is already blaming her future failures on covid.,1,Newsmax TV,StopOilmen Ripoffs
1175094,594422,If U don't do a forensic audit of vote dumps and match signatures... U got nothing but a Biden steal,1,Right Side Broadcasting Network,Lifelinz 4ever
711734,963344,"@jessy james Jessy James this kind of talk is not going to save people. It is true unbelievers will go to hell, but this kind of talk is going to push people away from the faith and not draw them nearer",1,CBN News,NJR Gaming
1453019,2186579,"Those ""liberals"" and ""stupid"" people who don't agree with Cain's philosophies really ought to stop name-calling.",0,RWW Blog,dorianlondon
2174598,1873727,Everyone watch 13th by Ava. Amazing film about how many people in prison never got a trial and pled guilty due to plea bargains.,0,The Atlantic,Nora Germain
2070529,2163957,How hypocritical. The same people who support the right's freedom to discriminate against the left are complaining about how left leaning social media companies discriminate against the right.,1,The Daily Wire,IceCream Brainz
1546823,814632,"James, I remember watching you around 2008. That's when I was voting for Obama 🤣",1,Project Veritas,Señor AHOLE
441044,251020,OMG HE LOOKS EXACTLY LIKE FRANK SINATRA wow he is gorgeous and a modern day HERO thank you.,0,The New Yorker,xiomana xoxoxo
281630,139411,I hate the way she bobs her head around to accentuate her attitude. And that smug smile from her little Somali friend. I hope they get kicked out of office as a  team.,1,One America News Network,Velasco Alverez
1570358,299458,Everywhere sadness & desolation to see that those politics are guilty for those death people those criminals  don't do nothing against this disaster,0,The New Yorker,loli cool
1683498,1351080,TO THOSE WHO ARE DEFENDING OUR PRESIDENT  . THANK EACH AND EVERY ONE OF YOU FROM THE BOTTOM OF OUR HEARTS  . GOD IS GREAT AMERICA IS BEAUTIFUL  . KAG2020,1,Fox News,paulmaldonado1969
1794537,1023069,"@Alexnder90 F actually i do see, its for Romes deception of futurism. Do you even know who invented Zionism? The Jesuits not Jews. The irony is you are arguing from a position of ignorance. An unbiblical one. However not once did i say the enemy wasnt moving in these areas.",1,CBN News,josh portie
1374255,1109617,I wear my MAGA hat everyday I also carry my gun!!!,1,MRCTV,Manuel G Chapa Jr
1955252,1450543,@the left wing mob I live in America your a racist,1,Fox News,Shan Bruton
1931500,582237,"thumbnail is misleading,  makes it look like there was 1 person that attended.",1,Right Side Broadcasting Network,Test Test
1262182,381391,so funny watching these vids of dem supporters getting tricked cause it's so easy and happens a lot,1,Campus Reform,nikapol25
1572793,404894,"So, bow-tie boy isn't curious why people do stuff?",1,Campus Reform,David Williams
1690959,1704353,YouTube is showing no other videos to watch... Wow,1,BlazeTV,Hans Hausen
613688,149147,"Very sensible move, so of course the far left will be dead against it.",1,One America News Network,stenka rasin
1578149,1937474,"Ive never heard of ""Media matters"" until this video. I like them. Thanks for advertising them for me Fox.",0,mediamatters4america,Notmyrealnamenumbers
839121,92423,Ok now we know for sure it’s obama. What’s going to be done about it? If Trump did it he would be impeached. Obama ordered it when he was president so should he be impeached in the books? Then seen as a traitor?,1,One America News Network,Butterfly Garden
2137473,810235,In this truth war the Times is fighting with lies and emotions.,1,Project Veritas,Jim Simpson
1543706,826770,These people didnt work hard! I mean they did in college and grad school but THATS IT! These 1% are  Opportunists....they have the  Opportunity to go to Harvard or Yale.......b/c mommy and daddy worked hard or grampa and grandma worked hard so that they COULD go do something great. This doesnt happen for the other 99% who would need to find a rich uncle to pay X amount of dollars so their family member can go to Yale and be one of 1% like the rest of the family. ,1,National Review,Billy
767349,388881,"@jussayin mipeece Of course you are just speculating but probably right. But the exact same thing can be said about every poll shown to us on the evening news, and we're somehow supposed to believe that. I think not.",1,Campus Reform,Ken Lee
21142,857904,Mr Trump the BEST President of the World ever 👍,1,Breitbart News,Carlos Eduardos
1099523,1238993,Voter fraud is a lot more widespread in this country that covid is in SD.,1,Newsmax TV,David Bruce
2105524,904707,Loved the video excellent. Love the Indian and his horse. Just a strap no bit. Love it,1,Breitbart News,Mark Gamble
113540,1009057,Walk the walk. Live the truth. Anybody can smile and say John 3:16,1,CBN News,Bill Carlton
626002,334050,"And Bill Reilly is ""Mr Pro Life but abandon them after they're born.""",1,The First,Lorne Hampel
1351857,1992518,So glad I didn't get a lunatic for a mother like this. LOL,1,The Daily Wire,Jo Seph
2186077,1850305,"Smartphones and addiction to social media is to blame. I remember back in last 90s i was able to chat up random girls at tran station, bus stops, libraries, university campus, even supermarkets...not all of these interactions led to sex but people were happy to meet new people. Nowadays everyone is looking too depressed, walking around with earbuds or staring in their smartphones. If you try to chat them up they look at you strange.
We live in apathetic and depressed society",0,The Atlantic,Hello User
64629,192108,All countries have an intelligence branch. Governments are aware of what is going on. Let’s fix our government first so we can actually change something. The problem is much closer and tolerant than we are to believe. Home grown,1,The Epoch Times,Kenneth Harper
797582,1402058,@Nikeo G. you're just jealous she's highly educated and you're a low life scumbag 😆,1,Fox News,Stuart Perssia
1252123,328038,Has there ever been a bigger narcissist than Barack Hussein Obama? I doubt it.,1,The First,RMPsumma
2066268,371593,well its not fair if they think its coming from someone they hate and its actually coming from someone they like...,1,Campus Reform,Mason Brown
937029,635843,you want trump back speak to JESUS everyday and GOD father trhough the holy spirit that trump comes back.. just 10 minutes a day we can do this.. we change the bible outcome of the antichrsit in jesus name,1,Right Side Broadcasting Network,turbo tennis consulting
2065800,920106,Trump needs to do a video where he is actually changing the tires on the Presidential Limo with Secret Service and he has to do this at the White House. Have the CEO of Cooper Tires or whoever be there as well. I bet that video would break the internet!,1,Breitbart News,Competition Sports 2021
400056,2053643,@ZepTepi when you keep fishing the same pond you found the last ones. with no change in preference or standard for yourself. You will continue to pull the same type of people each time. You have to raise your standards after the last person and stick to it. If they show one red flag out of the standards walk before you relationship them. That's why they say date before you get in a relationship. Like when you buy a house you don't buy the first one you see. You explore your options. Same with cars. Most people get it inspected before they buy. So interview your potential love interest by learning things that are in your interests.,1,The Daily Wire,Kat stephens
699869,706411,"​@Vagabond Wastrel I know, those poor Jews always being the victim.

Did you know that Jews have been kicked out of 109 countries? Wow talk about anti-semitism! What's up with that? Where did that come from?

And now a days It's like some people have some sort of problem with Jewish over representation in education, congress, entertainment, news, porn, advertisement.
It's like they don't know Jews are our greatest allies.",1,Project Veritas,Anti Foreign Colonization
465941,83754,"Abortion is the new Slavery. ""Well, it was Legal at the time!""",1,One America News Network,S B
1662543,643785,I would argue that socialists are loud as shit.,1,Conservative Review,Chuck Steak
518283,192984,It's time to take down Kung Pao Ping and his evil regime.,1,The Epoch Times,JohnnyTango111
1604132,260687,"@spaniol1997 have you considered that not everyone's interested in living in a LCOL area, especially if they don't believe in ""small town American"" values? Why would conservative country folks want liberal/progressive folks moving in, trying to corrupt their way of life? In what world would the conservative country and liberal city folks get along?",0,The New Yorker,StarberrySlash
2026860,608922,@PINKY BLISS as many times as he has cheated on all of his wives  im pretty sure  he has had to pay for a few abortions.   If a man grab your vagina  would  it be assault  or would you be fine with that.  United we stand and divided we fell right in to hell,1,Right Side Broadcasting Network,d j cuso
1184679,1490532,"Colleen McGuire exactly right ""he's had to fight that everyday since being elected"".  I agree as well you saw tonight that boil over and Trump does what he does fight for his defense and my belief he will do the same for our country.",1,Fox News,Jeff Buis
1022501,1660086,"Im still waiting for Adam Schiff and Jerry Nadler to explain how my 2016 vote with a pencil and paper was hacked by a country 6,000 miles away.",1,BlazeTV,Phil Turless
534182,1009354,OH PLEASE!  The book of the holy dribble. Keep your church and state seperate. We're not a bunch of Muslims.,1,CBN News,Robert G
810040,1632185,He was actually proud of her! She looks like a he.,1,BlazeTV,Carol W
