,index,text,class_id,website,author
1441565,103551,"Surely the crackpot FBI, and DOJ can get phone and text messages from those involved at the polling /counting centers . Psst , here's a clue call the NSA  and get it NOW! It all needs to be transparent so we can see what's happened.",1,One America News Network,Don Grosse
373287,2080794,"Why can’t Lemon be a good listener to his guest? He interrupts his guest and cut him off especially when d truth hurts,but he hurts many.Journalistand commentators should be hurt too,especially when they tell lies.Just because they hold the mic doesn’t meant they can lambast anybody with anything.CNN should learn from this..",1,The Daily Wire,MetzMakeMoney
1899427,1256972,"If you ignore the substantial evidence of fraud, the cost will be too high.",1,Newsmax TV,Andrew Muchtar
2147143,572070,"Yup, that's why we have the supreme court advantage.",1,Right Side Broadcasting Network,Happy Days
964348,1621180,@Michael Gonzalez Nation of Islam killed Malcolm X.,1,BlazeTV,Harshit Madan
1180711,1524848,"To quote someone smart: They are not confessing, they are bragging.",1,Fox News,criticalhorizon
825996,208202,"Why u have a Japanese apologising on behalf of the Chinese people.. .. maybe westerners cant distinguish all three of them , but we asian can . First lady is a HK er , second is a Korean and third is a Japanese . The strong catonese accent mix with English for the girl. The second who looks like one of the BTS members wearing a mask..the constant head nodding from the third guy.. that is what so great about Japanese people.. they have the culture and they he habit of head nodding while they are talking.",1,The Epoch Times,Hermanto Fudyanto
1704287,767110,Amazing - yep - suuurrre its an isolated incident.,1,Project Veritas,nancy27c
2138598,2215287,"What I was saying is you don't know enough about the bible, who wrote it, how it was assembled, the contradictions, the reasons for the choices of some gospels and not others... even the fact that Jesus as God was tacked on much later than everything else has to make you stop and think.
Calling it God's infallible word doesn't stand up to scrutiny.
That doesn't disprove God it shows you that YOU are the word of God NOT the bible.
Otherwise your relationship with him is  farce... think about it.",0,RWW Blog,Bernie Zelvis
1685037,2243945,"...part 2...This is where our govt is running into the dangers that are going to destroy this country.  The no longer are trying to create an evironment for opportunity, they are trying to control the outcomes.  ",1,Accuracy in Media,mrhoffame
10398,2052916,"@Spencer Tuft
Its google, obviously suppression type reasons.",1,The Daily Wire,Darken
817555,918493,This is just straight up creepy. Sorry this cannot be explained away as and affectionate old man. It's creepy as hell,1,Breitbart News,G Gg
1151544,1165683,"Certain news agencies. Like fix, I mean fox?",1,Newsmax TV,joshua blanchard
887055,706893,"G O
What's your channel called? I'm always happy to support my fellow small, suppressed YT brothers. The only way I see us beating the anti-freedom algorithm is to sub those who speak and encourage as many voices as possible. At the moment it's too easy to shut people down because there's so few voices.",1,Project Veritas,Rational Wrongthink
32986,2114026,"1) I'm so happy that Daily Wire put this out there, I was begging for this after hearing the podcast
2) This is truly glorious seeing Shapiro lose it :)",1,The Daily Wire,SethC12
1951680,1349181,"The reminiscent anatomy certainly guide because knowledge totally twist times a wrong hip. curved, ahead mice",1,Fox News,Planeta Curioso
1919431,2056853,@shoeman He has To run as a republican or independent.,1,The Daily Wire,onion yeeter 5000
1772491,1139317,sycamorebacker1 that's what politics should be; a place of nobodys not career politicians.,0,Daily Kos,Gimpy
1456759,441347,Wow what happened in the cities? Looks like the brain washing is complete in New York.,1,Campus Reform,R B
285549,857473,"Why do you ask a question when you don't know the answers?
Humans: O.O",1,Breitbart News,Arjun
738134,974152,Amen! Wtf are the men tho? Complacent fools,1,CBN News,Daniel Baltodano
2118742,1959241,"Morality is not just a word, it has to do with what is in the best interests of our society. For many people in this country (America) the Bible has been a source of moral guidance. Believers call the Bible ""The Word of God"" and there's no higher authority for a believer than that. Religion has to do with how people relate to God, your opinion to the contrary not withstanding. You must be an atheist to make such comments.",0,mediamatters4america,Karl Kurth
526738,1322758,Biden has lied since the beginning of political career!,1,Newsmax TV,Lori Menshew
2006670,2025028,She’s mad at Ruth for dying... well played Democrats,1,The Daily Wire,Jack Murphy
1597133,2193916,You are absolutely being discriminatory towards crotch shots and I don’t like it !!! 😡,0,RWW Blog,S L
177701,1834895,editor/producer needs to stop taking quaaludes,0,The Atlantic,carl casey
21709,2095573,"Richard Mincer hahahha ok. How about that time he said he was gonna build a wall and make Mexico pay for it? What about repealing and REPLACING obamacare? 

Now your turn :) tell me one thing he has promised to do that he has actually done you misinformed twat",1,The Daily Wire,Spencer Gray
1828722,95740,Astonishing how Dems always fall back on accusing their opponents of what they are doing.,1,One America News Network,David Longenecker
1845702,1177207,"EVERYONE, check your state's election site. Was your vote counted? Send that link to ALL you know. It's IMPORTANT in states with alleged issus. Report ANYTHING odd!!!",1,Newsmax TV,Jayb 1961
44998,582760,Donald Trump did more in a few weeks than Obama has done in eight years,1,Right Side Broadcasting Network,Isaias Cardoso
899611,165457,Rose here. Why don't you take Nancy Pelosi out with him what is she done for California what is she done for America nothing,1,One America News Network,Rose Wyers
740295,1920917,Comments by Sidhesh Patil - 🤔 Now I know why some people wear red skirts and pants.....a bit too often!,0,The Atlantic,Deepak Patil
2048549,405418,"So, basically, these kids are complete hypocrites.",1,Campus Reform,Allan David
2068683,410188,On point Lol COMPLETELY sums up the asshole teacher,1,Campus Reform,Wifey Pie
1107677,529188,THE SWAMP IS REAL!  AND DEEP!   🦀🦐🐜🦞🦑🦏🐽🦑🐾🕸🐍🐢🐉,1,Right Side Broadcasting Network,Flash back
1185565,1677674,"It's like when they dug up the dead body of Pope Formosus, tried his corpse, and excommunicated him.

They will continue to impeach Trump until they get a conviction.",1,BlazeTV,Some Guy
2210662,2028987,"SHAPIRO-Haley 2024'!
Ben, think about it.",1,The Daily Wire,ludlow saylor
1450809,1542758,"He means that a lot of people are going to see it and be encouraged to look further in to the story of the ark. And can you really not type ""God""? Are you afraid if you do, you'll lose your credibility of whatever you believe? (Coming from an agnostic/atheist)",1,WorldNetDaily,Dishdogz
2222700,1606001,"""It is not a crime""
""It is a crime. First time it's a misdemeanor, second time it's a felony.""
""Well I agree with you on that point""
WHO ARE THESE CLOWNS?!!",1,BlazeTV,Leedle Lee
1641775,636213,There will never be free and fair elections ever again. The Constitution is null and void. There is no law. There is only Might. Get your gun.,1,Right Side Broadcasting Network,thedrew4you
1127401,348082,Bar has always been a shill for the swamp!,1,The First,Bill Tsirtsis
576605,108157,"Unreal !!!! Omg , deeper & worse then I thought. I always disliked our government because I knew they were all snakes until Trump was elected ! Now I'm seeing just how deep & bad the snakes are !",1,One America News Network,Vonny Rucker
843342,202600,Very nice. Good news for Americans and Japanese. Don’t let China threaten,1,The Epoch Times,longxuyen12
929723,514978,"I wish he would have asked them about their right to kill another human at will, a right ONLY women have. Equal rights should give the responsible man involved a equal say in the issue.",1,Campus Reform,methag 2001
1191156,165281,"Git'er done!  You do, however, have to elect a decent governor to replace him.  Don't be stupid and elect another bad one.",1,One America News Network,Dustin VanKeuren
1556271,223499,"@Nomore Safehere I totally agree. The REAL enemy here and throughout history has always been the HANS. They are like the Borg, they kill, enslave, and assimilate everyone into their collective. Resistance is futile!",1,The Epoch Times,Transplanted Local
1347487,423096,"@Deknis That's exactly who I'm talking about. She knew about Georgia's voter law, recent voter suppression there (probably the voter purges), and didn't change her belief that strict voter ID laws reduce voter turnout, just because some Republican badgered her with a poll.",1,Campus Reform,Sandal_Thong
822312,497590,The girls are all going to end up dating guys that can't even lift them up 😂,1,Campus Reform,Epstein didn't kill himself
203878,679544,Jakey Yes it does! I love it when a good plan comes to action. 🇺🇸👏👏⚡,1,Project Veritas,Sgt. Mayhem
449795,1206239,"BS!  He was a lot, lot better than Trump,aka, bunkerboy.",1,Newsmax TV,G N
1074486,1872583,it was quite uncommon back in the days to know or even celebrate your birthday in india. most of the people just came up with a date and called it their birthday.,0,The Atlantic,Nafi
1836970,1138356,These individuals need to get out of the State of Oregon NOW!. They should not be touching those items without a Medicine Man there.,0,Daily Kos,Lula Earle
73823,18966,Just goes to show you You dont know what you are letting in the old saying ( a wolf in sheeps clothing )build the wall,1,One America News Network,Robert Topp
228055,552684,"PRESIDENT TRUMP HAS MASSIVELY WON THE DEBATE. Read: 
:
Chris Wallace: Mr. PRESIDENT, you're having MASSIVE rallies but you VP Biden are having much less number with few people distanced!! 
❤❤❤ President Trump: ...which NO ONE WATCHES. (HAHAHA, AWESOME ANSWER! HAHAHA, AND VERY VERY TRUE.) 👏👏👏👏👏👏👏👏👏👏
. 
Chris Wallace's only good question asked of Joe Hiden was, ""You said you ARE the Democrat Party now! As a Democratic Party, have you ever called the Governor of, let's say Portland to stop the riot, to call in the National Guard?"" 
LIAR Joe: This is not my JOB to do that!!!!!!!! 😆😂🤣😅😆🤣😂😅🤣😂😆😆😅
Public sense: So why is it your JOB to call the looters, rioters, arsonists, and shoplifters a PEACEFUL protest, you ""phony face LIAR DOG""??? 🤮👎 
. 
😲WOW in answer to ridiculous defense of his son Hunter Biden's glorious,haha, background, our Precious President Trump replied, ""Who, Hunter? Hunter Biden was kicked out of military because of COCAINE USE."" WOW. What a SUCKER FAMILY OF THIEVES AND WRONGDOERS, WHAT A DEN OF ROBBERS. WOW. 🤮🤮🤮🤮🤮🤮🤮🤮🤮🤮🤮🤮🤮🤮🤮🤮🤮
. 
Precious President Trump: Why are you even AFRAID to ""say"" LAW &ORDER, Joe???? 
LIAR Joe who wants chaos for America to make the President look bad is like: 🤐🤐🤐🤐🤐🤐 MORON clueless Joe. 
. 
❤🙂When Precious President Trump is ready to send the Law & Order people, DemonRATS-run states stop them. 🤮👎This means the Demon.RATS 🤮👎 want chaos, to make our Precious President Trump look bad. 😡Woe to them. #Trump2020 #Trump2024 #IraniansForTrump #MAGA ❤❤❤ 
. 
😅😂🤣😆😅Biden's face went chalky white when Precious President Trump talked about the thief son Hunter Biden being paid BILLIONS OF GOVERNMENT MONEY with NO EXPERIENCE!! Biden never answered but just mumbled jumbled and TWISTED like he did throughout the debate. 🤮🤮🤮🤮🤮👎👎👎👎
.
This SCHMUCK LOSER Biden has NO IDEA what he's talking about, as he says, by reopening the country, millionaires and billionaires will love Trump!!! What??? Yo, IDIOT, small businesses are hurting, they need to go back to work, it's not like your son Hunter Biden who stole 1,500,000,000 billion dollars from Gov contracted co Burisma, YOU have become rich by stealing from the government, NOT them. STUPID THIEF!!! 
.
Precious President Trump: ""If you could get the rally CROWDS, you would have done the same, but no one cares about you."" GENIUS ANSWER. Sleepy LIAR Joe, go HIDE in your BASEMENT!!! 🤣😂😆🤣😂😅😅😂🤣😂😅😆🤣😂😅
.
ALZHEIMERS Joe checks his NOTES all the time!!! This is a DISGRACE to his few followers and to the Americans!!! 🤮🤮🤮🤮🤮🤮🤮🤮🤮🤮🤮🤮🤮👎👎👎👎👎👎👎👎👎👎👎👎👎👎👎👎
.
Precious President Trump: More than 35,000 people wait outside the airport for my rallies which there's no problem according to the [looks at Sleepy LIAR Joe] EXPERTS. HAHAHAHA you should have seen the look on LIAR Joe's face!!! Hahahaha!!! 👏👏👏👏👏👏👏👏👏👏
.
👏👏👏👏👏👏👏👏👏👏👏👏👏👏👏👏👏👏👏👏👏👏👏👏 Summary of the debate very well and powerfully said by Precious President Trump: ""he wants to shut down the country and I want to keep it open."" 👏👏👏👏👏👏👏👏👏👏👏👏👏👏👏👏👏👏👏👏👏👏👏👏👏👏👏👏👏👏👏
.
Hahahaha, awesome answer by our precious President Trump: Don't talk to me about being SMART because you were in New Hampshire and you thought you're in North Carolina!!! Hahaha. 🤣😂😅🤣😂😅🤣😂😅 Sleepy ALZHEIMERS Joe!!!
.
GAFFE Joe: 100,000,000 applied for it!!!
President Trump: That's not true. Where did you get that number??? 
Sleepy LIAR Joe: (QUIET.) 
Hey LIAR Joe, IF YOU DON'T DARE TO BACK UP YOUR WORDS, SHUT UP IN THE FIRST PLACE. 
.
😍😍😍 Saw it in C-SPAN, before they started the Debate. Great to see many Trump supporters in the room with MAGA Masks and Voice For Trump tshirts. #Trump2020 #Trump2024 #IraniansForTrump #MAGA 😍😍😍 
.
Sleepy chucky-cheesecake Joe Hiden is talking about the ELECTRIC CARS to save the environment!!! HaHaHa, so how many ELECTRIC CARS has he had them built during his 47 years of being STEALING from the government??? NONE. ZERO. And NOW he's gonna do all that?????? HaHaHa, C'MON MAN, go HIDE IN YHR BASEMENT... C'MON MAN!! Hahahaha. Trump's existence is a SLAP to the faces of all the thieves out there, INCLUDING this CLOWN Joe Hiden. 😂🤣😆🤣😅😅😆😆😂🤣🤣😆😅
.
O my gosh! This Joe Biden dude is a TOTAL LOSER, he has NOOOOO CLUE whatsoever what he's talking about, for he's been defending the Green New Deal set up by his fellow Demon.RATS butnow he's TOTALLY DENYING that he's supporting it!!!! What a chucky cheese liptard RETARD he is!!! Ugh,if it wasn't for our precious President Trump, I wouldn't watch a SECOND of it. I wonder why those few people follow this ALZHEIMER RETARDED NO-CLUE CHILDMOLESTER CHILDSNIFFER CHILDTOUCHER?!?!?! 🤮👎🤮👎🤮👎👎
.
😆😂🤣😅 So Joe Hiden CLAIMS President Trump is gonna go, he's not gonna stay in power, huh? Robert Loser DeNiro CLAIMED the same, night show hosts CLAIMED that, O'Bummer CLAIMED the same in 2016, and we saw how ASHAMED they've become after Precious President Trump got elected. November the third, we'll see, Joe LIAR Biden. 🙂🙂🙂
.
Precious President Trump: ""We caught you, Joe, SPYING ON MY CAMPAIGN, with that LOGAN ACT, along with Obama and the Crooked Hillary, we caught you on tape, it's all there."" Joe must be ASHAMED OF HIMSELF, and must GO TO JAIL even for this single FRAUD. 
.
Jill Biden even hugs her HUSBAND with a MASK on!!! HAHAHA. SUCH HYPOCRITE FAMILY. HAHAHA. 😂🤣😂😆😆😂😂🤣😅🤣🤣😆😆😆😂😂😅😅😂😆😆🤣🤣😅🤮👎 
.
❤❤❤ GOD BLESS AMERICA AND GOD BLESS OUR PRECIOUS PRESIDENT TRUMP. ❤❤❤
.
https://youtu.be/wW1lY5jFNcQ",1,Right Side Broadcasting Network,movenglish
268636,1412651,Always whip out that salt rock first id say,1,Fox News,win one soon
1776094,410049,Yup teachers like this is pretty normal sadly...,1,Campus Reform,Christine Lee
1147635,966440,"@The Truth Im interested in their xenofobic culture, their strong conservative link to the ancient past (shinto). I love how politically incorrect they are.",1,CBN News,DevasionX
137115,1150813,Thank you Newsmax for bringing us the truth,1,Newsmax TV,Tim
1070477,1219175,"@areolaman Do you count 100,000 + a pack of lies. That's how many dead people votes they found so far. Just in one state. (Fact)",1,Newsmax TV,MegaSkills9
165308,1265810,When Obama makes that face...he's been busted out,1,Newsmax TV,Hammer H
2068810,250095,@Tulan Zuya antifa is too busy breaking things and screaming in everyone's faces to be taking selfies.. it also destroys their purpose of staying anoynomous lol.. antifa doesn't really take selfies,0,The New Yorker,Npc I'm knot
1136806,2032129,https://m.youtube.com/watch?v=URz-RYEOaig,1,The Daily Wire,Jo King
21567,64506,Back a few months ago his tone was a little different when the president saw to it he got everything he asked for including the good ship lollipop in new York harbor.,1,One America News Network,John Harris
208394,1902629,Bruh most hospitals still use old tech because their stuff is not compatible with new oses,0,The Atlantic,Anthik
1046409,1736851,So the government is going to raise your kids...great idea,1,BlazeTV,Maximus141
2102757,10080,"Ciaron Smith you are joking right?
Go to Luton in a mini skirt see what happens.
Did you not watch the video of what is happening in England too?
You are either a denier or you are one of them.",1,One America News Network,The Inquisitive Cat Channel
1189274,80872,"Herd Immunity has always been the solution, we have an immune system for a reason, to build immunity",1,One America News Network,Jens P
567457,1077737,logic: killing baby is good but don’t kill animals that’s cruel,1,MRCTV,ko so
952770,1847080,Killer Gamer427 ..control fire to control uncontrollable fire,0,The Atlantic,George Cy
1700484,1685410,"WH realized how terrible ""CIRCLE BACK LADY"" is and that she needs help. That's way they want reporters from now on to submit their questions before she gets on stage. HOW NICE OF THEM??????",1,BlazeTV,X Y
1057888,1235224,"@Alastair MacGillivray  the Cult is not those disagreeing with Trump. The Cult is the sheep blindly following the lies of the MSM and Communists. Trump is just an obstacle in their way but the cult of conspiracy theorists is real.
What's funny is you think I'm a Trumpster, I'm not but I am an American Veteran and Patriot. ...and I know the Law.",1,Newsmax TV,L.J. Silver Austere Privateer
1729192,1693963,"doughesson all imaginary people are immune. Santa, leprechauns, tooth fairy, etc. 🤷‍♂️",1,BlazeTV,Melissa Porter
180955,1470107,@Kel H love this President. He is not playing games with these idiots 🇺🇸😎,1,Fox News,Juan Vigil
510152,274658,Why it sounds insanly similar to the speech he gives,0,The New Yorker,np
1948405,1152959,"Not if  you are insulin resistant, or have diabetes",1,Newsmax TV,Cesar Hernandez
207297,1460104,Newsom is such a hipocrite. He's not sorry for attending a fundraiser party but that he was caught!,1,Fox News,Chuck Stith
991721,756279,This shit goes on in high school sports. Big deal.,1,Project Veritas,The Rant With Grant
1259248,1711741,"Machine Gun Bacon!!! That was eggsiting! 
A toast to Ted! And freedom.",1,BlazeTV,BULELENG'AR
2055796,1119287,You cannot empower others by telling them that they are always victims. That is a contradiction. Movements like Leftism with illogical beliefs that appeal to selfish people are destined to collapse. It is only a matter of time.,1,MRCTV,King of Spain 578
1212080,1166377,So far the legal team has released the Kitten. I really hope there is Kraken because it's looking iffy at this point.,1,Newsmax TV,Six Strings
143621,329900,"Thank you, Sir. What you said is really true. Unfortunately, there are so many dumbs who believed the lies.",1,The First,Norman Dickinson
1335067,2161452,"Aquaman does indeed have super strength, though what he is most known for is his ability to talk to fish so one can rightly assume that that is what super power Matt was referring to when he said Aquaman.",1,The Daily Wire,Vik Maytron
1924519,1787685,“this is my fucking life” Malik your R. Kelly is showing,0,The Root,FREE SMOKE
1637022,431736,"God, if this is so, is China controlling our education? That is scary.",1,Campus Reform,Bacon Egg
444358,332622,"However this rolls out, our elections process is a FAIL. its too easily defeated.",1,The First,Marty VanDuzer
197413,1090163,My truth is now that I am a attack helicopter.,1,MRCTV,kubel83
749461,1716268,"This woman has so much strength, fantastic.",1,BlazeTV,Johnny Rocket
19259,1291597,@Berra Lilltroll if the loss was fair none of this would be happening!,1,Newsmax TV,Daddy DeadBones
2130738,2192763,Sanatorium should respect the separation of church and state.,0,RWW Blog,Peter Sun
1445817,1756753,"Valid concerns, valid problem, the Democrat solution is to send out more —the Democrats motto “I see dead people ... and now they need to vote!”",1,BlazeTV,Steve Gurgon
663584,1980937,"Yeah agreed . She’s perfectly entitled to her opinion, but it’s a great sign of maturity that she sook to understand a possibly opposing viewpoint .",1,The Daily Wire,treno guerrero
1245407,690859,"Im thinking veritas purposely put him in there without an attorney. Like bait. Hook line and sinker witness tampering and the IG took it!  Think about it.  Veritas deals with whistleblowers all the time and they know a lot about WB protections etc. and he even said that Veritas said to talk to them before talking to anyone, which he likely did before this and knew to record it. As far as two party consent, if the IG was recording, that means IG is already consenting to be recorded. Not just by them either. But by Alex too. I think this was all done in the manner it was to expose witness tampering. Expose the corruption at a higher level. Okeefe would have advised him to get an attorney if it wasn’t all set up. 

You know when testimony is muddled when the interrogator is doing more talking than the witness themselves.  Alex was giving his original comments in the original affidavit per recalling what he had heard. Within the first like 30 mins the guy made him nit pick what he remembered by making him feel like he had to recall specific words/quotes that he heard and only the specific words/quotes he heard should be included in his statement. Kind of like trying to recall a convo you overheard where someone said “he went into the garage and then he hid the weapon in one of his toolboxes” - his recollection would just be that he overheard that he hid the weapon in one of his tool boxes, but the only specific words he remembered hearing was “garage, weapon, toolbox” - if a person was trying to discredit this witness they’d say “well you don’t recall the specific words “in between” so you’re just using your logic to “fill in the blanks” - which is not true. He was just recalling what he had overheard, but using his own words to describe what he overheard.",1,Project Veritas,Mamsy 11
1026512,881415,Biden is so used to plagiarized that he tried it again. 🙄 and failed! 🤭🤭,1,Breitbart News,Sassy Gil
60318,1342315,BIDEN'S COMMITING TREASON AGAINST AMERICA!👿🇨🇳👿🇨🇳💵💸💵💸💵💸,1,Newsmax TV,stardustgirl
172757,730110,She treated the judge like he was stupid.God is with Project Veritas!,1,Project Veritas,Elaine Ekberg
895413,111748,"Hitler, and his district Attorneys as his soldiers.",1,One America News Network,G money
696096,944924,"A person is free to hat Christians, a person is free to hate Muslims, a person is free to hate Satanists, a person is free to hate Jews.  ITS Freedom.  Its freedom of thought a speach.  GO TO ISRAEL",1,Breitbart News,Loveiseverything
1331035,1747623,they have mansions yachts and private jets that require alot of money ok. just deal with it and dont ask questions,1,BlazeTV,power max
1900850,517830,Haha!!! Snap out of it!! Try to shake that brainwashing.,1,Right Side Broadcasting Network,Jo G
763220,233944,If just keeps getting worse for the people I'd china 😔🙏,1,The Epoch Times,Raphaela Hons
1559287,174657,"@Nikki Hanover No, I mean something he’s actually earned. Like an orange jumpsuit, or a one way ticket to the senior center. In order for him to get the he’d need to win legitimate election, which he hasn’t.",1,One America News Network,Jay More
1228446,220818,Peter Lawrence  biggest polluter on earth= China,1,The Epoch Times,suzy schwarz
1811940,851133,"Even though we ALL know who is ACTUALLY running for president, I didn't see this one coming! GENIUS!",1,Breitbart News,Sig Guy
89796,1051121,"is it really about the gays??? or is it about the anti-semitism all that talk about the ""jews"" killing jesus???? think about it",1,CBN News,Joey Bazooka
1742808,1963735,"@AdmiralMorningWood  we r not a christian nation, and alot of itellegent people own guns,if another country invaded us it wouldnt be the millitary they would have to worry about...",0,mediamatters4america,lonnieke
1750273,1099763,The greatest generation still fighting fascism 70 years later...,1,MRCTV,TexanDog
1988125,378664,“Education is let people know about ... uh... stuff..” while wearing a sweater saying “BULL”,1,Campus Reform,C O
766393,969392,"I’m speechless! I had no idea how devout she is. I’ve have a deep respect for the job she’s doing, but now I see her in a whole new “Light.” She is a Truly Blessed woman. Hallelujah!🙏✝️",1,CBN News,R. T.
