,index,text,class_id,website,author
1649519,105581,"Well Santa Fe used to be beautiful to visit. Now they have Thousands of illegal Aliens. This includes the Drug Cartel they are also in Albuquerque. So many Gangs are posting up in both areas because they also have *WEAK LAWS* So gangs and Drug Cartel get away with a lot. m
My sister works in ABQ. at the hospital. So she tells me a lot about those cities. She will be transferring out of that state in 2 wks, Thank God!",1,One America News Network,KarmaDontForget
41165,1638873,A president the armed forces would go into any battle for and the last one who’d send them there without good reason,1,BlazeTV,Bryn Stuart Jones
1132370,1423845,"My God Has His Back,HAPPY BIRTHDAY BROTHER DONALD TRUMP!!!",1,Fox News,Mike Bachert
997943,1777495,I have google and u tube thats it and thats to much,1,BlazeTV,Robert Biondo
1788670,1067347,"MARC LAC i concur 
And dont preach God Jesus
JUST BE GOOD TO MANKIND AND LOVE ❤
💖🌿🌹
 aug 27th",1,CBN News,Alexis Newell
1642765,874514,He should of asked them why aren't any of you wearing them?  I doubt they have been tested.,1,Breitbart News,BOARD GAME MAN
818133,2172003,These people are completely and utterly delusional. And I have an Idea for a really crappy movie and I want Andrew Garfield and Robert De Niro to star in it. They should just do it.,1,The Daily Wire,Dave B
1079675,717812,"These leftists have absolutely no honesty and honor.Even in their core circles,you can see that they were doing their ""job"" under the name of laws/policies/morality/justice,while what they actually did is totally against humanity.",1,Project Veritas,悟得循環真諦在
394382,1926499,"We hold these truths to be self-evident, that all men are created equal, that they are endowed by their Creator with certain unalienable Rights, that among these are Life, Liberty and the pursuit of Happiness.--That to secure these rights, Governments are instituted among Men, deriving their just powers from the consent of the governed, --That whenever any Form of Government becomes destructive of these ends, it is the Right of the People to alter or to abolish it, and to institute new Government, laying its foundation on such principles and organizing its powers in such form, as to them shall seem most likely to effect their Safety and Happiness. Prudence, indeed, will dictate that Governments long established should not be changed for light and transient causes; and accordingly all experience hath shewn, that mankind are more disposed to suffer, while evils are sufferable, than to right themselves by abolishing the forms to which they are accustomed. But when a long train of abuses and usurpations, pursuing invariably the same Object evinces a design to reduce them under absolute Despotism, it is their right, it is their duty, to throw off such Government, and to provide new Guards for their future security.--Such has been the patient sufferance of these Colonies; and such is now the necessity which constrains them to alter their former Systems of Government. The history of the present King of Great Britain is a history of repeated injuries and usurpations, all having in direct object the establishment of an absolute Tyranny over these States. To prove this, let Facts be submitted to a candid world.",0,The Atlantic,Eggdoggo
1252007,1692757,"""trying to hide the purpose of their argument""; look at the body language of Nadler, he can't hide any thing, Collins just dropped a bunch of truth on him, and Nadler wishes he were somewhere else.",1,BlazeTV,Posttronic
158099,1741107,"If it's only one thing you want to thing you want to thank Trump for, then thank him for exposing to a lot of us these far left globalist media organizations who are out to destroy this great country.",1,BlazeTV,Jack Straw
248972,315803,"There is only a couple tv shows I like, other than that I agree, not much on. These shows about stranded on an island, who cares. On over the air tv channels they put on a lot of older shows from the 60's, 70's and 80's. I find these are better than most anything on now.",1,The First,jdtractor man
1731705,1167186,"Hat snot right is. Gov newsome about to be recalled
Recall, good idea for other rats in the swamp",1,Newsmax TV,Ann Pippin
1807926,833271,"No offense but the interviewer is not made for interviewing, NO TACT at all! Come on we are all thinking this.",1,Breitbart News,Stephanie Groulx
995710,2097099,"Joe Biden did the cardi b interview cause he heard WAP, and thought ""i bet she'd let me smell her head""",1,The Daily Wire,Singing Tallit
1015677,531138,My gratitude to everyone at this meeting. You have done more than you can imagine. May you inspire me continuously to be grateful for this country 🇺🇸. Your inspiration will fuel mine and may we continue this challenge.,1,Right Side Broadcasting Network,HelpMeDrLee
221255,1271997,"@Mike Wilkerson kind of funny how trump supporters are always calling the left ""snowfkakes"" when all I ever see are the trump supporters who are crying and whining about everything all the time...

Let's see the excuses that you trump supporters say about these things...

Trump's secret Chinese bank account?
Or trump paying $180k+ in taxes to China?
Or trump paying $100k+ in taxes to India?
Or trump paying $100k+ in taxes to the Philippines?
Or trump paying $15k+ in taxes to Panama?
And how much has trump paid in taxes to his own country over the last 15 yrs or so?
No wonder trump doesn't want anyone to see his taxes...

Or how about trump and family making all their products in china?
or when Ivanka trump received all those Chinese trademarks while trump was fighting his trade wars and our American farmers were going bankrupt?
Or when ivanka was stealing designs from other designers and having the products made in china and india paying next to nothing in wages?

And you all claim that it's Biden that's in bed with China?

Trump claims to be a law & order president but refuses to pay for that law & order in the 14 cities that he agreed to pay for the extra police & security needed for his rallies. Trump owes almost $2 million dollars to those 14 cities & is now telling those cities to sue him if they want their money. So trump apparently does not really support the police or he would have paid them like he agreed to....guess who is going to get stuck covering all that overtime pay? The cities will have to make up those lost dollars, it's the people of those cities that will eventually have to make up the difference if the city doesn't have it. Just shows you just how much trump really cares about the people in this country.

BTW, save your childish lefty insults for others because I'm a conservative and yes, I am going to vote for Biden along with many other republicans and also with the republicans that have worked with trump who know exactly what trump is doing and has been doing to our country!
If those people are voting for Biden, that should tell you something about trump",1,Newsmax TV,Laur Pellett
1023153,509272,"This is embarrassing & shameful.   This answers so many questions though with antifa & blm.  No wonder.  They don't know what happened 19 years ago, so anything before that is unknown to them.",1,Campus Reform,Luke Mehalick
873465,1345179,Can we stay focused on the election fraud? No other issues can be resolved without lawful elections.,1,Newsmax TV,truffleturkey7
909664,583015,"Brian Kemp GA
 Refuses full audit of votes. July 2019 he met Li Qiangmin, Consul General of China in Houston. In the same month Kemp bought the Dominion Voting software. A Chinese govt company bought Dominion for $400 million.",1,Right Side Broadcasting Network,Torrito R
1057993,1557950,"+Orient Express No it's not dumb. Considering gays are punishable by death in the Middle East, if your gay brother was visiting Iran or Saudi Arabia, and they stoned him to death for engaging in homosexual activity, then moved here to America, they most likely would not be in jail since they hadn't broken any laws in their home country. Unless you had video of the incident, then likely nothing would happen to him in America either. But that's very ""progressive"" and ""tolerant"" of you to make him a cake still because ""no one is above the law."" Your priorities are really fucked up. These bakers said they've served gays many times before, just didn't want to make a gay marriage wedding cake because it's against their religious beliefs. As long as your religious freedoms don't harm anyone, that should be above all else. It's the First fucking Amendment.
https://www.washingtonpost.com/news/worldviews/wp/2016/06/13/here-are-the-10-countries-where-homosexuality-may-be-punished-by-death-2/?utm_term=.8fbe6cbe5e2c",1,The Daily Signal,Elven Mage Jr
612414,1960015,"I'll try again.

If the government had no power to stop us from drilling then Business couldn't pay them to make the law. 

Where the hell in the constitution does it give congress the right to tell ANYONE if they can drill on their own property?

Am I getting through?

The trouble grew as the government's power grew. Take back the power; problem solved.",0,mediamatters4america,VerbotenDingleberry
431298,1397247,군산시성산면고봉산미군비행장시절나열여섯그해군산시도막직업은해비행장악이용헬기장난문나도독그금형시청공개석사반이절이들이내방반세월미국텔레반총후직업남에방너무써머리가나뻐공부재로현장고봉산안테나오성산기증간첩이북집기상청오크마슬럼프사람사찰비행기날여묵쏘소름지금보고오성산밑하수인절감강도소골드려찜질방복나만보면웃겨목욕탕탈레반느중공쓰그날부럼중국집여자하나남성둘가치다녀내나라촬형싱심더러워보고분슬퍼악이빨주변악스,1,Fox News,박양순
398709,850776,@Sara Kiba oh ya. In 3 1/2 yrs of this peach we've got super spreading idiots who wont wear a mask yet scream about lockdowns. Civil unrest we havent seen in 60yrs. Protests galore. Right Wing wackos trying to kidnap Gov bc they dont like them (wah) tanked economy like we havent seen since the great depression and 211 THOUSAND DEAD AMERICANS that could still b alive but ya he's a real fucking gem.,1,Breitbart News,annie oakley
1020056,1536887,School Indoctrination is 100% a reality. I went to school in NY graduated in 2017 and had to fight tooth and nail against left wing politics being pushed.,1,Fox News,Mason Turner
1763642,188293,"Big pharma is on the boards of major media. 
Criminals for sure !
https://youtu.be/giVY-Qnqd5Q

80 million now have autism according to CDC>
https://youtu.be/Hch33RhTyLg",1,One America News Network,jake glenn
55144,31849,Chris Brimhall and jailed for a very long time,1,One America News Network,Bobby Stephens
982572,1749247,He ask what’s gonna make them money now and she’s it’s best to invest in infrastructure it’s crazy politicians can just say things like that to our face,1,BlazeTV,Leo Luke
1516423,1121516,"""Somehow.......'I told you so'.....just doesn't quite say it""'.  The 0.3 percent doesn't know if they've been shot, fucked, powder burned, or snake bit. This has got to stop.",1,MRCTV,Mike juba
745004,892383,"""Replace it with what's appropriate today"" who the f??k that be then? Who does she considers to be ""appropriate today"" how about the criminal ran Chaz/chop calls himself warlord!",1,Breitbart News,flukeman022
1706368,486111,Michael Lawrence being afraid bit going through with it anyway. That is bravery.,1,Campus Reform,Ron Sutton
1260955,1328327,He scared to get out that why he peak look the window,1,Newsmax TV,Darlene Boone
547195,388998,"This is a way of teaching mental arithmetic, albeit a needlessly complicated one. There are better ways of subtracting by mental arithmetic (in this case either subtract ten then subtract two or vice versa). However in missing out the traditional method the student actually misses some understanding of numbers.

Many of the common core techniques I have seen are actually base on teaching number theory. This is great for the top 0.1% who will go on to study mathematics at university. They are the ones that are good at maths, and will learn this anyway (it is fairly obvious to me, and I did not study maths at university). Those techniques introduce so much complication that they are potentially catastrophic for those who are not good at maths.",1,Campus Reform,Doubting Rich
414233,665593,I've heard that CASINO GUARDS are METICULOUS beyond MEASURE. ESPECIALLY the ones working up above the ceilings.,1,Project Veritas,An Ombre Rose
181791,1312825,"I CANNOT GET MY HEAD AROUND THE FACT THAT DEMOCRATS WILL NOT ALLOW SCRUTINY. RECOUNTS A WASTE OF TIME WITHOUT PROPER ACCOUNTABILITY.  THIS DEMOCRAT PLANNED MESS WILL NEVER BE FULLY INVESTIGATED AS IT'S WAY TOO BIG WITHIN ALLOCATED TIME FRAME. SIMPLY THE PROBLEM,  VOTES AFTER ELECTION DAY NULL & VOID. HAVE TO DRAW A LINE SOMEWHERE.",1,Newsmax TV,j t
61868,858847,"2024! She'd have my vote too.
Today my question is, why do we have aoc in our house and not Candace Owens?",1,Breitbart News,Trump is US
497020,1263403,Good reporting Greg Kelly god  thanks for newsmax 👍👍,1,Newsmax TV,Tommy Nygaard Jensen
758162,899541,"Doesn't look like they need many, but I imagine there are some around the hospital.",1,Breitbart News,sandyk067
103,1241967,Absolutely everyone involved in election fraud needs to be investigated and prosecuted to the absolute fullest extent of the law.,1,Newsmax TV,Mary Fagan
848550,2221453,"I wonder what kind of ""word from the Lord"" Jim was trying to find out when he was boinking Jessica Hahn all those years ago.",0,RWW Blog,Rocket Lawnchair
155074,1100056,"Obama does have socialist policies, but he is not a Socialist. As Social Security is part of society in America.",1,MRCTV,Tom Hickson
1049654,609305,I NEVER BELIEVE DEMOCRATIC PARTY. I NEVER BELIEVE DEMOCRATIC PARTY,1,Right Side Broadcasting Network,Hoa Le
829189,460065,"That young lady in the red dress is ignorant and clueless. The ""white boy"" she's with gets it.",1,Campus Reform,Thad P.
394266,840488,Abhay Liginlal it would shut down the server,1,Breitbart News,Snowflake Slayer
1983506,2215047,"Sorry, very bad example I think.  Stromatolites are not living creatures.  They're *formed* by living creatures.  They are very different today, not because the creatures that made them evolved into something else, but because other living creatures alive now that weren't alive then break them down before they become as big and grand as they used to be.",0,RWW Blog,geodgereturns
1804239,1368447,"The high school students being shunned by their friends is real. By showing even a little skepticism or disagreeing with any of the major points, I've put myself at risk to loose friends faster than if I were to actually stab them in the back. I love the friends that have pushed away, and some of them simply pushed away because I took time to wait and comprehend what's been going on. I've said stupid things as jokes to people I considered friends, but I always try to apologize to them when I've gone too far. People who used to judge me based on my character, now judge me based on whether they think I'm a racist or not.",1,Fox News,DroorznZ3 _
1669420,1130396,@Todd Jones just like his administration.  Trump is clueless.,0,Daily Kos,humanforotherhumans
1696234,340636,"I think that too, But I could be wrong. but BYE- DONE  will not win anyways",1,The First,jeffrey c
646185,1924014,"Cows emit methane more from their mouths than from their anuses.  That's just how they pass gas--- by burping.  Science, go figure",0,The Atlantic,Jonathan Schneider
1627649,1503476,Good thing I'm homeschooling from our home on wheels👍 If I don't like the home location 🔑 Keys in the ignition and bye bye ✌,1,Fox News,Pyro Kitty Kat
762342,2074901,"Everyone is laughing and thinking, for the first time in their careers, ""he's not talking about me""",1,The Daily Wire,Francisco Menano
553742,1462718,Jesus Lord help Juan....he is not well....😓just so sad!,1,Fox News,Richy C
867328,1983598,"@Bullet Anarchy lmfao I'm serious. There's a code set at conseption that defines the race, hair color, eye color etc",1,The Daily Wire,cool cattle
1569186,1122827,"So if this bill passes it sounds like it wouldn't be against any law to shoot anyone you wanted, like Omar, AOC, Pelosi,  Shumer, etc etc. Hmmm might have to think about that one.🤔🤔🤔",1,MRCTV,Bigpapa 58
1440103,1999958,"I like that there is the little fact check box about the election on this when it's just talking about the candidates,and not the election itsself",1,The Daily Wire,walkstheman98
559276,644588,"@Eric Madsen he was worked up, lol. I knew what he meant also......",1,Conservative Review,txman201
980285,1832352,"They may be intelligent, most Intelligent people lack this one certain thing, it's called "" Common Sense "".",0,The Atlantic,pzitry
1772581,224984,Although he did claim to lockdown the country (again) and require mask mandates even outdoors.,1,The Epoch Times,Tina Leubecker
176126,1291896,"@J Hutch again, if you guys have something newsmax doesn’t this is as good a place as any to leave it. Accusing me of refusing to listen to it when I’m asking you for it since I can’t seem to find it anywhere else is pretty poor form tbh",1,Newsmax TV,Magic Mike Pence
1463175,718913,Non-U.S.A. citizens voting illegally becomes an issue on the Final day of Mid-terms... Seriously?!,1,Project Veritas,Michael Nasau
1826639,1496631,"@jimmy Lionstar He is more of an administrator with a wide degree of autonomy than a puppet, and a very good one. This is one of his few failures.",1,Fox News,wAterHead102
538455,1329582,"Funny how all those 5-page speeches about the Insurrection ,were already written!!!!",1,Newsmax TV,Big Daddy
2033064,877396,"I actually liked the job Sanders did, but this chick is on a whole different level.  She's a killer!",1,Breitbart News,FANTOM
715430,1973247,David is it their fault that as soon as Rush gets on ESPN he starts making a race issue about Donavan McNabb and how the media treats him. It sure looked like he had diarrhea of the mouth bringing up an unecessary and untrue race issue. They asked him to resign immediately. I'm pretty sure God called ESPN and said to boot him. I'm telling you God is good because he doesn't have a problem crapping on your buddy. Also you get on a computer and say racial names and they are damaging America?,0,mediamatters4america,OG
2211990,987705,Jesus bless you rifqa you are in the right faith in God.,1,CBN News,Litto Omega
2180058,1909552,Especially if you do not tow the party line(CCP)!!!,0,The Atlantic,brian bullivant
2134389,2220593,"Gawd lied to you about SO MANY things though.  A gawd that leads even his most fervent blood-diamond miner astray can't be all that Smurfy, can he Pat?  And don't give me any of that ""mysterious ways"" crap either man.  Hell, the IRS sometimes works in mysterious ways and you wanted to BOMB them!  Listen, working out can help when you're stressed.  I know yoga would open you up to demon possession, so just have a shake, and go leg press a Prius or some shit.  ",0,RWW Blog,TonyZXT
998212,470313,"You can protest, still illegal to Destroy other people's Property!",1,Campus Reform,Kyle K
1809400,898405,"@Duncan Hine who cares how much tax he's paid?  Seriously, the IRS won't let him get away with it.  C'mon man!  Wtf does that have to do with policy?",1,Breitbart News,Me and My
368548,1229230,"Excellent explanation and illustration of dems gaslighting tactics!  👍 👍
Excellent explanation and illustration of why President Trump got into politics! 👍 👍",1,Newsmax TV,Marcus Sylvester
508700,1356937,Plot twist: the guy who started this meme is an fbi agent who wants to lower the population count,1,Fox News,Stephbee
1596572,2171007,"Does the ""Resistance"" follow or not follow the Covid19 guidelines?",1,The Daily Wire,Ted Zink
1750579,1658670,"David Fauvelle Yep, nothing more compelling and interesting than a true enthusiast,  even if the actual theme isn't quite your thing. I commend you mate,  total admiration.",1,BlazeTV,Glasgow Gallus
526200,176477,"@Bob Adkins They increased taxes on households making over 400k annually, something many people don't, hence not gonna effect much at all",1,One America News Network,Eric Mathew
1431242,441787,"@Pedrobambino Perez Having lived with Socialist healthcare as well as the current US healthcare system, I consider my education on the topic to be complete. I’ll gladly accept what we currently have here to the NHS. 

“Free” indeed.",1,Campus Reform,I.M. Dunn
1440727,2016476,Awkward fake laughter when confronted with inconvenient facts:  Hillary Clinton 101.,1,The Daily Wire,John Shaft
553920,56658,"Red Faux   That’s right!  Then they told the citizens of New York to go out and visit the sites and have a great time instead of preparing the city for Covid.  Then New Yorkers started dying like flies from the new disease and they turn around and blame Trump.  He sent ventilators and a hospital ship, and they still hate him.",1,One America News Network,Bee Smart
1758991,376952,Feel is used as an alternative to in my opinion.,1,Campus Reform,Jacob Hogan
71710,2108029,This is proof that they expect to not be challenged which is a mark of tyranny,1,The Daily Wire,William Henry Van Etta
1427995,2144026,Candace knows very little about anything.,1,The Daily Wire,Cell Sec
332593,1770242,"r  Republican views are supposed to be the same as Libertarians,  but Republicans have been passing a lot of Socialist and Communist laws, like the Patriot Act after 911 and Universal Healthcare-Libertarians were outraged. They believe these laws are government overreach.  The party is small, but has been growing as a result of Trump's handling of the Coronavirus.  Democrats and Republicans are defecting to this party.",1,BlazeTV,V Bin
1817408,393165,How in the HELL are these kids aloud to vote? This is very scary. They are only saying what the professors tell them.,1,Campus Reform,Devils Pleasure
860630,2082256,"He hasn’t been using the rappers slang COME On Man , he’s forgotten the words can somebody tell him cause he sounds funny,",1,The Daily Wire,Pee Tak
1453281,363197,"Sometimes when a drug addict goes to jail, it's a life saving thing not a punishment.",1,The First,orowock1
1184913,1476592,"Biden mean buy america, maybe he's making  a suggestion for China to buy America. Or maybe bye America.",1,Fox News,Douglas Schuler
1973423,1119801,It wasn’t Trump supporters that invaded the Capitol.,1,MRCTV,seoceancrosser
871630,467305,Actually this is what true ignorance looks like.,1,Campus Reform,TotalMusicJunkie
525181,769560,She doesn't want to interrupt her income. Can't say I blame her. So she gave up the chance to be a hero instead she's just another zero,1,Project Veritas,3 M's
1477853,2201564,@WoodyLittle It's like praying...but SO much more rewarding! ;) ,0,RWW Blog,NeoIsrafil
1968256,2062497,Just because he talks fast doesn't mean he's a robot,1,The Daily Wire,Turiaki
1144809,521898,Good job american people for voting trump! Thanks from finland.,1,Right Side Broadcasting Network,Kharn The Betrayer
438626,137833,Waiting. This reminds me of Jeopardy when the answers are being written you get this little tune. How long will this tune last. We The People demand justice.,1,One America News Network,TheBuddy1939
1665026,1810608,@Bob Roberts one of the least? That is complete bull shit.,0,The Root,Good Watch
1410946,1600809,"""Are you using the word ""illegal"" to describe acts which are in violation of the law?""",1,BlazeTV,duckpwnd
176234,1372674,"Biden tough on China? What’s that mean, he dusts off his own knees while he zips up Xi when he’s done demanding more from the USA. Good on ya joe",1,Fox News,Norma Wingo
490887,1291110,If this is left till then....then it is too late,1,Newsmax TV,GulfportFlameFighter
1519345,1791156,Yes VIvian WAS..because you were the BEST and Baddest,0,The Root,ryan Amari
1615015,645372,Good journalists being silenced by Big Tech,1,Project Veritas,McDonald Trump
666258,1747042,How about all the censorship going on from Twitter and Facebook and YouTube etc!??,1,BlazeTV,Mallett Adventures
218632,39778,"@devin bryan  hey, I'm not against verification or investigation. Bring it on. It's going to the courts. It's being looked into. I don't think anyone is blocking investigation. But anyone can make wild accusations. I think people are trying to sift through the wild accusations and a valid ones. But still, even if you overturn a few thousand votes, you are unlikely to change the outcome. And if you do a recount you might find that Trump has even fewer votes than you thought. When you do a recount it can go either way.",1,One America News Network,River Bank
2091594,491105,The most offensive things are you people not the mascots. DUH,1,Campus Reform,Red Sox Nation
1661172,1307621,@M S YOU should ask Joe Biden or Obama on the costs!,1,Newsmax TV,Blue Sky
1129852,144478,Best news in the past month so far.........,1,One America News Network,WTF BBQ
1877772,2121356,My god. He is going to be eaten alive! Kinda feel bad,1,The Daily Wire,Hector A Pereira
753654,869056,Dam she's so beautiful and knows how to hold her ground 😍,1,Breitbart News,Abraham Gonzalez
2100440,536722,The real US president! Biden still couldn't fill a school bus with supporters.,1,Right Side Broadcasting Network,Todd Wyatt
116269,672901,"James O'Keefe is a 
National Treasure..!!!",1,Project Veritas,E.A.R.
1561223,1737634,These reporters are just pandering to the Satanists on the left..,1,BlazeTV,frank hinstine
645214,2036123,Can we get a link to the original article? Where is the citation here?,1,The Daily Wire,Alex Zander
1066545,644505,Great as usual Michelle.  You are a future star.   And very smart and beautiful too.,1,Conservative Review,frederick gramcko
